{
  "$schema": "http://json-schema.org/draft-07/schema#",
  "version": "1.0.0",
  "description": "Schema for offer primitives registry",
  "type": "object",
  "additionalProperties": false,
  "required": ["primitives"],
  "properties": {
    "$schema": { "type": "string" },
    "version": { "type": "string" },
    "description": { "type": "string" },
    "source_section": { "type": "string" },
    "primitives": {
      "type": "array",
      "minItems": 1,
      "items": {
        "type": "object",
        "additionalProperties": false,
        "required": ["id", "name", "purpose"],
        "properties": {
          "id": { "type": "string", "minLength": 1 },
          "name": { "type": "string", "minLength": 1 },
          "purpose": { "type": "string", "minLength": 1 }
        }
      }
    }
  }
}
